081法登000013,1,1,張茂寅,998,0720429,0720429,0720429,44冊33頁,,0,董事長,財團法人中央營建技術顧問研究社,0720429,台北市民生東路四段五四號九樓九０三室,承辦都市計畫等之規劃與開發自來水下水道及環境科技之研究與工程之設計操作管理建築技術及其他公共工程有關土木水利等之測量設計施工監造與檢驗等事項。,由建華工程顧問,中國瓦斯水道,三冠工程顧問,集美工程顧問等股份有限公司及內政部營建署共同捐助,"內政部七十二年一月二十七日  ︵七二︶台內營字第一三一八九五號函",永久,2100000,1,0720429,0720429,,,,,,,,,,
081登000024,1,2,張茂寅,1574,0810108,0810115,0810115,63冊57頁,1,1,辜振甫,財團法人海峽交流基金會,0800208,台北市敦化北路201號10樓,本會以協調處理台灣地區與大陸地區人民往來有關事務，並謀保障兩地區人民權益為宗旨。,由行政院及工商界捐助,行政院大陸委員會八十年二月八日　陸法字第０二二三號函,永久,895000000,1,0810115,0810226,0810117,,,,,財產總額原登記新台幣6億7,000萬元整變更為新台幣8億9,500萬元整。,,,,
081登000035,1,2,張茂寅,1233,0810131,0810210,0810210,52冊25頁,1,2,廖欽福,財團法人福華慈善公益事業基金會,0761123,台北市仁愛路4段2號4樓,本基金會以舉辦或捐助慈善公益事業為目的，包括下列各項：辦理社會慈善公益事業。協助社會福利救助事業。學術研究及優秀清寒學生之獎助。接受主管機關指導辦理事項。其他有關慈善公益事業事項。,以現金,內政部中華民國七十六年十月二十八日台︵七六︶內社字第五四四四七四號函,永久,85000000,1,0810210,0810226,0810210,,,,,財產總額原登記新台幣6,800萬元變更為新台幣8,500萬元整。,,,,
081登000048,1,2,張茂寅,1478,0810212,0810218,0810218,60冊43頁,1,1,陳重光,財團法人國際美育自然生態基金會,0790417,台北市仁愛路4段101號5樓之1,實現融合真、善、美的真文明及追求世界永久的和平。,由日本美育國際協會捐贈，並接受對外認捐。,行政院農業委員會七十九四月九日　農林字第九一一三二九九Ａ號,永久,17000000,1,0810218,0810513,0810220,,,,,財產總額變更為新台幣1,700萬元正。,,,,
081登000055,1,2,張茂寅,1335,0810215,0810221,0810221,55冊53頁,1,1,蔡萬才,財團法人富邦慈善基金會,0771229,台北市建國南路1段237號10樓,舉辦醫療補助、急難救助、災害救助、或捐助其他有關慈善事業等事項。,由國泰產物(股)公司、富邦投資(股)公司、忠興投資(股)公司捐助。,"內政部七十七年十二月十七日  台(七七)內社字第六六０七五六號函",永久,215000000,1,0810221,0810513,0810221,,,,,財產總額原登記新台幣2億1,000萬元變更為2億1,500萬元整。,,,,
081登000056,1,2,張茂寅,1475,0810215,0810221,0810221,60冊37頁,1,1,蔡楊湘薰,財團法人富邦文教基金會,0790411,台北市建國南路1段237號10樓,以提高國民生活品質、宏揚文化、發展社教、培養人才及舉辦藝術性、教育性、正當休閒娛樂等活動。,由富邦投資、忠興投資及富邦證券等股份有限公司共同捐助。,"教育部七十九年三月二十三日  台社字第一二三八七號函。",永久,175000000,1,0810221,0810513,0810224,,,,,財產總額原登記新台幣1億7,000萬元變更為1億7,500萬元整。,,,,
081登000072,1,2,張茂寅,1439,0810228,0810304,0810304,59冊25頁,1,1,侯博文,財團法人侯政廷公益事業基金會,0790105,台北市長安東路1段9號7樓,發揮人與人之間互助精神，並以文化、教育提昇生活品質，促進社會和諧與和樂。,由捐助人皆以現金捐贈之,"台北市政府社會局七十八年十二月十二日  北市社二字第四三一七四號函",永久,15075132,1,0810304,0810513,0810313,,,,,財產總額原登記新台幣1,000萬元變更為1,507萬5,132元正。,,,,
081登000093,1,2,張茂寅,835,0810316,0810318,0810318,39冊5頁,1,4,各董事,財團法人味全文化教育基金會,0681221,台北市松江路125號3樓,培育各種專門人才、推行社會教育、研習各種技藝、增進國內外人民之溝通與瞭解、促進家庭生活之美滿與和諧，進而促成安和樂利之社會。,由各董事募集捐助或接受有關機構，社團及個人之捐助,教育部中華民國68年12月15日台(68)社字第39135號函,永久,72642550,1,0810318,0810513,0810327,,,,,財產總額變更為新台幣7,264萬2,550元整。,,,,
081登000096,1,2,張茂寅,1353,0810320,0810325,0810325,56冊29頁,1,1,連　戰,財團法人連震東先生文教基金會,0780321,台北市敦化南路464巷5號2樓,以獎勵學術研究、提昇教育文化水準、促進國內各學術機構及文教基金會之交流連繫為宗旨。,由財團法人連雅堂先生文教基金會捐贈。,教育部七十八年三月十六日　台（七八）高一一七０二號函,永久存續,67585278,1,0810325,0810513,0810331,,,,,財產總額變更為現金新台幣6,361萬5,418元正及台北區中小企業銀行股票面值396萬9,860元正。,,,,
081登000148,1,2,張茂寅,1451,0810501,0810507,0810507,59冊49頁,1,1,游淮銀,財團法人新道文教基金會,0790215,台北市光復南路262號8樓之3,協助倡導倫理道德，促進社會和諧進步為宗旨，從事或贊助編著出版、發行，並支援舉辦有益社會大眾身心健康之文化活動。,富隆證券股份有限公司等捐助,"教育部七十九年一月廿五日  台︵七九︶社字第三九六六號函",永久,83000000,1,0810507,0810627,0810518,,,,,財產總額變更為新台幣8,300萬元正。,,,,
081登000191,1,2,張茂寅,1587,0810608,0810610,0810610,64冊23頁,1,1,游天木,財團法人台北市法輪常轉文教基金會,0800507,台北市萬華區西園路1段128號12樓,以佛陀的慈悲與智慧教誨為依歸，結合信眾致力於佛法、社會、生活的推動與實踐，藉以端正風氣，淨化心靈，服務人群，促進社會進步和諧為宗旨。,由台北佛教同修會捐助,台北市政府教育局八十年四月二十五日　北市教四字第一七六七四號函,永久,10705519,1,0810610,0810815,0810622,,,,,財產總額變更為新台幣1,070萬5,519元整。,,,,
081登000222,1,2,張茂寅,1192,0810629,0810706,0810706,51冊3頁,1,1,許玉樹,財團法人中華民國獅子眼庫基金會,0760206,台北市建國北路2段188號11樓,配合國策發展眼科學術，加強視力保健及保障視障社會福利，發起救盲復明運動，使受惠者變視障為正常從黑暗中重見光明。,許玉樹等十七人捐贈,行政院衛生署七十六年一月十六日衛署醫字第六三四二八八號函,永久,10284717,1,0810706,0810815,0810715,,,,,財產總額變更為新台幣1,028萬4,717元整。,,,,
081登000277,1,2,張茂寅,1280,0810805,0810812,0810812,54冊3頁,1,2,黃少谷,財團法人辜公亮文教基金會,0770426,台北市敦化北路122號,以期透過本國與各國學術機構暨民間企業團體之交流活動，推展本國工商企業之經營管理、醫學研究、文藝、及其有關活動為宗旨。,由中國信託公司等十一家公司捐助。,"教育部七十七年三月二十八日  台︵七七︶高字第一二六八三號函",永久,124300000,1,0810812,0811029,0810821,,,,,財產總額變更為新台幣1億2,430萬元正。,,,,
081登000317,1,2,張茂寅,1353,0810901,0810905,0810905,56冊29頁,1,1,連　戰,財團法人連震東先生文教基金會,0780321,台北市敦化南路464巷5號2樓,以獎勵學術研究、提昇教育文化水準、促進國內各學術機構及文教基金會之交流連繫為宗旨。,由財團法人連雅堂先生文教基金會捐贈。,教育部七十八年三月十六日　台（七八）高一一七０二號函,永久存續,70957778,1,0810905,0811028,0810916,,,,,財產總額台北區中小企業銀行股票部分變更為面值新台幣734萬2,360元正。,,,,
081登000361,1,2,張茂寅,664,0811007,0811021,0811021,33冊23頁,1,5,陳盛泉,財團法人新力股份有限公司文化教育基金會,0650303,台北市林森北路372號2樓,以舉辦或獎助文化教育及公益事業為宗旨。,由新力電氣股份有限公司捐助,教育部中華民國64年12月15日台(64)社字第33580號函,永久,17000000,1,0811021,0811231,0811029,,,,,財產總額變更為新台幣1,700萬元正（不動產台北市中山北路2段77巷47號建號8871號建物1戶，新力股份有限公司股票275萬6,171股）。,,,,
082法登000010,1,2,張茂寅,287,0811223,0820105,0820105,20冊11頁,1,,鈕長耀,財團法人台北市中華基督教衛理公會衛理堂,0560204,台北市大安區新生南路1段113號,宣揚基督教教義，實行基督教真理及服務人群。,由本堂教友及熱心之中外團體或人士捐贈。,台北市政府五十五年十一月二十五日　府民行字第五九九五一號函,永久,33464736,1,0820105,0820224,0820113,,,,,財產總額變更為新台幣3,346萬4,736元整。,,,,
082法登000129,1,2,張茂寅,1177,0820315,0820317,0820317,50冊33頁,1,3,鄭國華,財團法人鄭俊生文教公益基金會,0750905,台北市復興北路201號6樓之3,本會以運用本會基金孳息及各界捐款辦理文教及公益事業，其主要業務如左：家境清寒或成績優良之大專青年酌情給予獎助學金，使其繼續就學完成學業。養老院、孤兒院、家庭扶助中心逢年過節給予慰問。,由鄭國華先生等四人共同捐助,"教育部七十五年八月二十一日  台(七五）高字第三六六六三號函",永久,11805155,1,0820317,0820413,0820326,,,,,財產總額變更為新台幣1,180萬5,155元正及國壽股票2萬1,450股、竹企股票3,429股。,,,,
082法登000337,1,2,張茂寅,998,0820708,0820708,0820709,44冊33頁,1,0,蔡兆陽,財團法人中央營建技術顧問研究社,0720429,台北市民生東路四段五四號九樓九０三室,承辦都市計畫等之規劃與開發自來水下水道及環境科技之研究與工程之設計操作管理建築技術及其他公共工程有關土木水利等之測量設計施工監造與檢驗等事項。,由建華工程顧問,中國瓦斯水道,三冠工程顧問,集美工程顧問等股份有限公司及內政部營建署共同捐助,"內政部七十二年一月二十七日  ︵七二︶台內營字第一三一八九五號函",永久,2100000,1,0820708,0820716,0820716,,,,,,,,,
082法登000451,1,2,張茂寅,589,0830505,0830505,0830506,30冊53頁,2,2,鄭惠芝,財團法人台北市私立立人國民小學,0630706,台北市大安區安和路二段九九號,為遵照國家教育政策暨現行教育法令之規定,辦理私立立人國民小學暨附設幼稚園，並謀其健全發展。,由前任董事長孫霆先生、常務董事鄭惠芝、孫陛麟、于斌捐助。,台北市政府五十四年八月十二日　府教國字第三六０一九號函,永久,1100120241,1,0830505,0830517,0830517,,,,,,,,,
083法登000128,1,2,張茂寅,998,0830315,0830315,0830317,44冊33頁,2,2,蔡兆陽,財團法人中央營建技術顧問研究社,0720429,台北市民生東路四段五四號九樓九０三室,承辦都市計畫等之規劃與開發自來水下水道及環境科技之研究與工程之設計操作管理建築技術及其他公共工程有關土木水利等之測量設計施工監造與檢驗等事項。,由建華工程顧問,中國瓦斯水道,三冠工程顧問,集美工程顧問等股份有限公司及內政部營建署共同捐助,"內政部七十二年一月二十七日  ︵七二︶台內營字第一三一八九五號函",永久,2100000,1,0830315,0830325,0830325,,,,,,,,,
083法登000453,1,2,張茂寅,998,0830820,0830823,0830824,44冊33頁,1,5,翁茂城,財團法人中央營建技術顧問研究社,0720429,台北市民生東路四段五四號九樓九０三室,承辦都市計畫等之規劃與開發自來水下水道及環境科技之研究與工程之設計操作管理建築技術及其他公共工程有關土木水利等之測量設計施工監造與檢驗等事項。,由建華工程顧問,中國瓦斯水道,三冠工程顧問,集美工程顧問等股份有限公司及內政部營建署共同捐助,"內政部七十二年一月二十七日  ︵七二︶台內營字第一三一八九五號函",永久,2100000,1,0830823,0830831,0830831,,,,,,,,,
083法登000612,1,2,張茂寅,1618,0831122,0831124,0831125,65冊29頁,2,2,王瑞瑜,財團法人台北市私立扶生社會福利事業基金會,0801011,台北市民生東路四段五四號七一二室,以辦理醫療救濟為目的。,"ROCHEUX INTERNATION","INC.  諾實國際公司捐贈",台北市政府社會局八十年九月廿六日　北市社二字第三七八四二號函,永久,10000000,1,0831124,0831206,0831206,,,,,代表法人之董事：王瑞瑜。,,,,
084法登他000575,1,2,張茂寅,998,0841124,0841124,0841124,44冊33頁,,0,翁茂城,財團法人中央營建技術顧問研究社,0720429,台北市民生東路四段五四號九樓九０三室,承辦都市計畫等之規劃與開發自來水下水道及環境科技之研究與工程之設計操作管理建築技術及其他公共工程有關土木水利等之測量設計施工監造與檢驗等事項。,由建華工程顧問,中國瓦斯水道,三冠工程顧問,集美工程顧問等股份有限公司及內政部營建署共同捐助,"內政部七十二年一月二十七日  ︵七二︶台內營字第一三一八九五號函",永久,10100000,1,0841124,0841130,0841130,,,,,,,,,
084法登他000616,1,2,張茂寅,589,0841218,0841218,0841218,30冊53頁,1,10,鄭惠芝,財團法人台北市私立立人國民小學,0630706,台北市大安區安和路二段九九號,為遵照國家教育政策暨現行教育法令之規定,辦理私立立人國民小學暨附設幼稚園，並謀其健全發展。,由前任董事長孫霆先生、常務董事鄭惠芝、孫陛麟、于斌捐助。,台北市政府五十四年八月十二日　府教國字第三六０一九號函,永久,1101538147,1,0841218,0841229,0841229,,,,,董事住所變更,,,,
085法登他000540,1,2,張茂寅,998,0851007,0851008,0851008,44冊33頁,1,5,翁茂城,財團法人中央營建技術顧問研究社,0720429,台北市民生東路四段五四號九樓九０三室,承辦都市計畫等之規劃與開發自來水下水道及環境科技之研究與工程之設計操作管理建築技術及其他公共工程有關土木水利等之測量設計施工監造與檢驗等事項。,由建華工程顧問,中國瓦斯水道,三冠工程顧問,集美工程顧問等股份有限公司及內政部營建署共同捐助,"內政部七十二年一月二十七日  ︵七二︶台內營字第一三一八九五號函",永久,10100000,1,0851008,0851018,0851018,,,,,常務董事張祖璿、董事劉淵銘、陳繼志請辭，繼任常務董事繼任董事蔡昭賢印鑑。,,,,
093法登他000633,1,2,陳茂哲,998,0930729,0930802,0930802,44冊33頁,1,7,蔡昭賢,財團法人中央營建技術顧問研究社,0720429,台北市中正區忠孝東路二段九十四號五樓,承辦都市計畫等之規劃與開發自來水下水道及環境科技之研究與工程之設計操作管理建築技術及其他公共工程有關土木水利等之測量設計施工監造與檢驗等事項。,由建華工程顧問,中國瓦斯水道,三冠工程顧問,集美工程顧問等股份有限公司及內政部營建署共同捐助,"內政部七十二年一月二十七日  ︵七二︶台內營字第一三一八九五號函",永久,10100000,1,0930802,0940428,0930810,,,,,董事長蔡昭賢印鑑變更。,,,,
093法登他000980,1,2,陳茂哲,497,0931207,0931207,0931207,27冊49頁,2,12,張孝威,財團法人中華民國企業界紀念張心洽先生學術基金會,0620219,台北市大安區忠孝東路四段一四八號十二樓一二０五室,本會為紀念張心洽先生設立,以促進經濟發展,社會安定為宗旨。,由中華開發信託股份有限公司等共同捐助，此後仍接受國內外公私團體或個人之現金財物等捐贈,教育部民國六十一年九月七日發文台六一高二一四六一號,永久,16000000,1,0931207,0940428,0931215,,,,,董事、監察人董事、監察人印鑑。,,,,
094法登他000191,1,2,陳茂哲,998,0940303,0940324,0940324,44冊33頁,2,8,陳信旭,財團法人中央營建技術顧問研究社,0720429,台北市中正區忠孝東路2段94號5樓,承辦都市計畫等之規劃與開發自來水下水道及環境科技之研究與工程之設計操作管理建築技術及其他公共工程有關土木水利等之測量設計施工監造與檢驗等事項。,由建華工程顧問,中國瓦斯水道,三冠工程顧問,集美工程顧問等股份有限公司及內政部營建署共同捐助,"內政部七十二年一月二十七日  （七二）台內營字第一三一八九五號函",永久,10100000,1,0940324,0950920,0940331,,,,,董事新任董事印鑑。,,,,
094法登他000896,1,2,陳茂哲,497,0941012,0941013,0941013,27冊49頁,1,12,張孝威,財團法人中華民國企業界紀念張心洽先生學術基金會,0620219,台北市大安區敦化南路1段263號13樓,本會為紀念張心洽先生設立,以促進經濟發展,社會安定為宗旨。,由中華開發信託股份有限公司等共同捐助，此後仍接受國內外公私團體或個人之現金財物等捐贈,教育部民國六十一年九月七日發文台六一高二一四六一號,永久,16000000,1,0941013,0951110,0941021,,,,,,,,,
095法登他000168,1,5,陳茂哲,790,0950303,0950306,0950306,37冊35頁,2,2,樂炳南,財團法人羅剛先生三民主義獎學金基金會,0671214,台北市文山區景興路177巷2號3樓,以羅剛先生畢生研究三民主義與從事三民主義教學，培養理論人才之精神，獎助在學研究三民主義優秀青年，淬勵奮發，學成報國。,依羅剛先生遺囑所註由其夫人范博理女士認捐,台北市政府教育局中華民國六十七年九月二十一日北市教四字第四一四八０號函,永久,2317915,1,0950306,0951213,0950306,,,,"羅  忠",清算人執行職務之情形與清算終結之日期：清算人了結現務，清算後賸餘財產計新台幣218萬6,736元整，全數捐獻臺北市政府社會局「不幸少年（雛妓）教育成長扶助專戶」及「兒童保護專戶」，清算完結後送請董事會承認，並向本院聲報清算完結，業經本院民事庭於95年2月14日以北院錦民和94年度法字第162號函准予備查。,,,,
095法登他000208,1,5,陳茂哲,1286,0950316,0950404,0950404,54冊15頁,1,4,廖俊榮,財團法人新學友文教基金會,0770518,台北市大安區敦化南路501號14樓,以激發兒童潛能為宗旨。,由廖俊榮等捐助,台北市政府教育局七十七年四月二十九日　北市教四字第一九二二二號函,永久,1000000,1,0950404,0951213,,,,115,廖俊榮,清算人執行職務之情形與清算終結之日期：清算人了結現務，清算後將基金會之預付稅款新台幣52萬4,417元整同意由其他短借之債權人概括承受結清；設備部份，以殘值新台幣3,985元整計價轉售給其他短借之債權人沖抵借款金額，清算完結後送請董事會承認。並向本院聲報清算完結，業經本院民事庭於95年2月7日及95年2月27日以北院錦民土94年度司字第749號函准予備查。,,,,
095法登他000736,1,5,陳茂哲,2007,0950815,0950817,0950817,78冊40頁,1,2,張瑞紋,財團法人台北市大愛慈善事業基金會,0860417,台北市建國北路1段78巷16號2樓,本基金會以辦理協助孤獨貧苦、獎助清寒學生、推行義診、急難救助等社會教化及公益慈善活動，提倡人體穴道學健康養生法，幫助社會大眾身心健康為目旳。,由張瑞紋女士捐助,台北市政府社會局八十六年二月二十四日　北市社二字第０七０四六號函准予設立,永久,10000000,1,0950817,0960903,,,,,張瑞紋,清算人職務執行之情形與清算終結之日期：清算人了結現務後，於93年9月30日清算完結，將剩餘財產新台幣1,007萬9,416元整全數贈與財團法人法鼓山社會福利慈善事業基金會，其清算各事項並提經93年10月16日之董事會議承認，且聲報本院民事庭94年2月18日北院錦民中93年度法字第99號函准予備查。,,,,
096法登他000339,1,2,陳茂哲,998,0960416,0960416,0960416,44冊33頁,2,9,黃宏順,財團法人中央營建技術顧問研究社,0720429,台北市中正區忠孝東路2段94號5樓,承辦都市計畫等之規劃與開發自來水下水道及環境科技之研究與工程之設計操作管理建築技術及其他公共工程有關土木水利等之測量設計施工監造與檢驗等事項。,由建華工程顧問,中國瓦斯水道,三冠工程顧問,集美工程顧問等股份有限公司及內政部營建署共同捐助,"內政部七十二年一月二十七日  （七二）台內營字第一三一八九五號函",永久,10100000,1,0960416,0970125,0960424,,,,,董事董事印鑑。,,,,
096法登他000365,1,5,陳茂哲,1906,0960424,0960427,0960427,75冊7頁,1,4,李中旺,財團法人全景傳播基金會,0850131,台北市松山區南京東路5段250巷5號4樓,以大眾傳播關懷社會為宗旨。,由全景文化事業有限公司捐助,行政院新聞局八十五年一月二十五日　（八五）強廣一字第一二一五號函,永久,500000,1,0960427,0970125,,,,,李中旺,清算人執行職務情形：清算人於95年7月11日完成向法院民事庭呈報清算人就任，期間進行財務的結算。結算後負債之金額為新台幣72萬8,602元整，其款項為本會董事暫借款。本會成立之基金50萬元及清算期間所得之利息9,577元加上銀行存款餘額1,187元，償還總額51萬760元整，本會仍負債新台幣22萬8,602元整，另有國稅局應退稅款2,002元整未退，暫借款經協商後取得董事同意放棄債權23萬604元整。　本會於96年1月18日完成解散登記程序，清算終結後召開第4屆96年度董事會，報告資產處理與債務清償事宜以及各項清償完結工作，並於96年3月7日向法院民事庭呈報清算終結，經法院民事庭以96年3月9日北院錦民松95年度司字第464號函准予備查。
096法登他000716,1,2,陳茂哲,1854,0960730,0960731,0960731,73冊31頁,1,5,沈富雄,財團法人首都文教基金會,0840221,台北市中正區北平東路7號之4," 6樓",以推動文教公共政策之研究、提昇文化藝術水平及全民生活品質。,由沈富雄等六人捐助,"台北市政府教育局八十四年二月四日  北市教四字第０一一二二號函",永久,5000000,1,0960731,0970815,0960808,,,,,,,,,
096法登他001021,1,2,陳茂哲,1618,0961109,0961112,0961112,65冊29頁,2,7,魏裕峰,財團法人台北市私立長生學社會福利事業基金會,0801011,台北市中山區復興北路516號4樓之2,以辦理醫療救濟為目的。,"ROCHEUX INTERNATION","INC.  諾實國際公司捐贈",台北市政府社會局八十年九月廿六日　北市社二字第三七八四二號函,永久,19800000,1,0961112,0970808,0961120,,,,,董事新任董事印鑑。,,,,
097法登他000058,1,2,陳茂哲,497,0970118,0970121,0970121,27冊49頁,2,13,張孝威,財團法人中華民國企業界紀念張心洽先生學術基金會,0620219,台北市大安區敦化南路1段263號13樓,本會為紀念張心洽先生設立,以促進經濟發展,社會安定為宗旨。,由中華開發信託股份有限公司等共同捐助，此後仍接受國內外公私團體或個人之現金財物等捐贈,教育部民國六十一年九月七日發文台六一高二一四六一號,永久,16000000,1,0970121,0970926,0970128,,,,,董事、監察人董事、監察人印鑑。,,,,
097法登他000565,1,5,陳茂哲,1110,0970530,0970603,0970603,48冊17頁,1,8,各董事,財團法人華僑商業銀行股份有限公司職工福利委員會,0740612,台北市中正區襄陽路8號,舉辦員工福利為目的。,由本公司實收資本提撥百分之五捐助。,七十四年四月二十六日台北市政府社會局　北市職福字第六五０號函,永久,6348450,1,0970603,0971114,,,,,李英忠,清算人執行職務之情形：清算人於96年9月20日經財團法人華僑商業銀行股份有限公司職工福利委員會第8屆6次會議選任為清算人並完成向法院民事庭呈報清算人就任，並依該會議之決議處理其職工福利金808萬7,376元5角，期間進行財務的結算，其中呈報清算人費用等計2,300元，發給未留任員工計24人，每人3,848元共計9萬2,352元，結餘799萬2,724元5角移轉予花旗（台灣）銀行職工福利委員會。於97年5月27日召開清算終結會議，報告資產處理與債務清償事宜以及各項清償完結工作，並於97年2月20日向法院民事庭呈報清算終結，經法院民事庭以97年3月12日北院隆民信97年度法字第1號函准予備查。
097法登他000661,1,2,陳茂哲,1618,0970620,0970715,0970715,65冊29頁,1,7,阮基成,財團法人台北市私立長生學社會福利事業基金會,0801011,台北市中山區復興北路516號4樓之2,以辦理醫療救濟為目的。,"ROCHEUX INTERNATION","INC.  諾實國際公司捐贈",台北市政府社會局八十年九月廿六日　北市社二字第三七八四二號函,永久,19800000,1,0970715,,0970722,,,,,董事長魏裕峰辭任董事長職務改任董事、董事林戴寶碧、張林麗華、陸文斌、許騰麒辭任及選聘常務董事，繼任董事繼任董事印鑑。,,,,
