052登000007,1,1,賴硃隆,186,0520415,0520417,0520417,13冊17頁,,,洪秀榮,財團法人台北市私立中原托兒所,0520417,台北市光復路421巷2弄2號,本所以服務社會幫助從業婦女解除兒童羈絆之困難並使兒童自小能養成良好生活習慣以促進其心身健康為宗旨,由董事捐募6萬5,000元及由創辦人兼常務董事洪秀榮借貸9萬元,臺灣省臺北市政府中華民國51年4月26日北市府社福字第33618號通知,永久,155000,1,0520417,0520830,,,,,,,,,,
054登000026,1,1,鄭有田,244,0540707,0540713,0540713,17冊17頁,,,"佩斯 Frank Pace"," Jr.",財團法人美國國際企業管理服務團台灣分團,0540713,台北市博愛路152號,本團成立之目的為在缺乏企業管理技術或不足應付經濟發展之各國已設立或即將設立之營業事業加強促進及加速有效之企業管理技術之發展及利用，以增進及協助世界各國之經濟發展並提高人民生活水準；並為達到上述目的，研究考察及調查以決定該等事業關於企業管理技術之特殊需求，同時對該等事業提供該等事業所需之企業管理或技術人員之服務為達成上述目的，本團應依照本團董事會所認為促進本團目的所必需之方法及程度行使其權力。,由美國國際開發總署捐助,經濟部中華民國54年6月18日經台(54)工字第12248號通知,永久,2244440,1,0540713,0541228,,,,,,,,,,
056登000052,1,2,陶振聲,61,0561107,0561126,0561126,5冊7頁,2,,顏春安,財團法人台灣省台北市東門基督長老教會,0470403,台北市臨沂街57巷17號,本會以傳揚基督引人歸主並舉辦慈善育英公益事業為宗旨。,信徒樂意捐獻,臺灣省臺北市政府中華民國47年3月1日(47)北市社組字第07271號通知,永久,439079,1,0561126,0580221,,,,,,董事新增不動產總額為35萬3,679元。,,,,
059登000041,1,2,王有樑,345,0590810,0590811,0590811,22冊37頁,1,1,郭清輝,財團法人台北市行天宮,0580118,台北市民權東路261號,本宮以宏揚聖教，闡揚五倫八德，提倡節約敬神，廢止焚化紙錢、謝絕奉獻金牌、演戲、供奉牲醴等鼓勵人群正義，促進社會祥和為宗旨。,由黃欉等265人共同捐助（詳捐助人名冊）,臺北市政府中華民國57年12月30日57.12.30府民二字第60054號函,永久,21250160.92,1,0590811,0591231,,,,,,為接受捐助人李炳昆先生將其所有坐落台北市北投區嗄嘮別段嗄嘮別小段554-33、-61、565、565-5、-6、-9、-11、-12、-13、-18、1055-1、-10、-15、-16、-23地號土地共15筆所有權全部捐贈與本財團法人所有，價值新臺幣119萬8,718元正，奉臺北市政府民政局59.7.31.北市民一字第4779號通知核准備查。,,,,
062登000084,1,1,王維靜,528,0620630,0620702,0620702,28冊51頁,,,蔣吳冠芳,財團法人中美文化技術服務基金會,0620702,台北市敦化南路3號11樓,本會以興辦海洋開發、石油探採、機械及船舶設計、高樓建築等計劃之技術研究、規劃與施工監督；并設研究機構與國內外大學、研究所及有關機構從事建教合作及學術獎助，以培養專門技術人才，提高國內工業及船舶技術水準，而達到加強經濟建設，福國利民為目的。,本會之基金預定由創辦人蔣一成先生及其所經營、代理、代表之公司機構捐助不動產或現金新台幣1,000萬元為基礎，並先於本會成立時一次捐助新台幣100萬元。,臺北市政府教育局中華民國62年6月29日北市教輝四字第20501號函,永久,1000000,1,0620702,0621220,,,,,,,,,,
065登000048,1,2,王維靜,637,0650515,0650515,0650515,32冊29頁,1,1,趙鴻志,財團法人基督教台北神的教會,0640609,台北市南京東路4段53巷7弄1號,本會宗旨在台北市各地傳佈基督教教義，辦理公益事業及宗教教育事業。,信徒自由捐獻，個人特別奉獻或接受國內外教會團體及個人捐助,臺北市政府民政局中華民國64年4月3日北市民三字第4624號函,永久,1072852,1,0650515,0660516,,,,,,財產總額：新台幣107萬2,852元整（內不動產87萬2,852元、存款20萬元）。　,,,,
066登000097,1,2,潘天壽,528,0660902,0660902,0660902,28冊51頁,2,,蔣淑珍,財團法人中美文化技術服務基金會,0620702,台北市敦化南路3號11樓,本會以興辦海洋開發、石油探採、機械及船舶設計、高樓建築等計劃之技術研究、規劃與施工監督；并設研究機構與國內外大學、研究所及有關機構從事建教合作及學術獎助，以培養專門技術人才，提高國內工業及船舶技術水準，而達到加強經濟建設，福國利民為目的。,本會之基金預定由創辦人蔣一成先生及其所經營、代理、代表之公司機構捐助不動產或現金新台幣1,000萬元為基礎，並先於本會成立時一次捐助新台幣100萬元。,臺北市政府教育局中華民國62年6月28日(62)北市教四字第034號許可證書,永久,6399975.85,1,0660902,0661201,0661116,,,,,董事新任董事李曜林印鑑。,,,,
068登000036,1,2,王維靜,557,0680330,0680330,0680330,29冊49頁,2,2,汪寶瑄,財團法人革新雜誌社學術研究獎助金基金會,0621217,台北市許昌街26號,本會以獎助革新雜誌社社員，從事學術研究為目的。,由革新雜誌社捐助,臺北市政府教育局中華民國62年11月23日(62)北市教四字第036號許可證書,永久,314000,1,0680330,0680716,0680427,,,,,董事財產總額：新台幣31萬4,000元整。,,,,
073登000137,1,2,陳淑敏,528,0730716,0730716,0730716,28冊51頁,1,6,蔣淑珍,財團法人中美文化技術服務基金會,0620702,台北市仁愛路4段110號,本會以興辦海洋開發、石油探採、農業科技資訊教育等計劃研究，辦理學術獎助，培養專門技術人才提高國內工業水準而達到加強經濟建設，并從事國民外交以加速實現三民主義統一中國之政策。,本會之基金預定由創辦人蔣一成先生及其所經營、代理、代表之公司機構捐助不動產或現金新台幣1,000萬元為基礎，並先於本會成立時一次捐助新台幣100萬元。,臺北市政府教育局中華民國62年6月28日(62)北市教四字第034號許可證書,永久,6399975.85,1,0730716,0731003,0730723,,,,,,,,,
074登000055,1,1,陳淑敏,1094,0740325,0740325,0740325,47冊45頁,,,張則堯,財團法人保險事業發展中心,0740325,台北市南海路3號仰德大樓6樓,本財團成立之目的在促進保險事業之健全發展，增進保險、被保險人及社會大眾之共同利益。,由保險業務發展基金管理委員會捐贈現金328,808,548.21元及財產（電腦）4,354,451.79元。,財政部中華民國74年3月11日(74)台財融字第12850號函,永久,333163000,1,0740325,0740404,0740328,,,,,,,,,
074登000091,1,2,陳淑敏,1033,0740513,0740513,0740513,45冊43頁,1,1,吳三連,財團法人陳逢源先生文教基金會,0721213,台北市南京東路3段36號企銀大廈,為提高我國文化水準，辦理文藝創作、學術研究之獎勵及上項優良作品之出版與出版獎助或符合本會創立宗旨之文化教育等有關事業。,捐助,"教育部七十二年十一月三十日  台︵七二︶高字第四九七四七號函",永久,11000000,1,0740513,0740604,0740521,,,,,財產總額：新台幣1,100萬元。,,,,
075登000006,1,5,李慧兒,773,0750108,0750108,0750108,37冊1頁,1,,辜濂松,財團法人台北市醫望雜誌社,0670817,台北市重慶南路1段83號6樓,本社以提高醫學水準，加強開業醫師之研習教育為目的。,由中國信託投資公司及魏火曜、李克承、吳作仁等共同捐助,臺北市政府新聞處中華民國67年3月23日67府新一字第10871號函,永久,981000,1,0750108,0750108,,,,,許建基,清算人執行職務之情形：依據捐助及組織章程第18條規定，辦理解散時所剩餘之財產應無條件捐贈政府慈善機關，該社剩餘財產為3,036.5元，全數捐贈予台北市立廣慈博愛院，經本院民事庭以74年10月3日北院立民丁74司140字第34161號函准予備核並經臺北市政府新聞處74年12月7日北市新一字第10749號函存案備查。,,,,
076登000114,1,5,李慧兒,548,0760703,0760703,0760703,29冊31頁,1,1,各董事,財團法人育群獎學基金會,0621106,台北市懷寧街118號,發起人等為求家父張公岳軍（諱群）家母馬育英夫人宏揚福音利濟人世之夙志，得以光大永久起見，特捐資設立獎學基金，專用於獎勵神學、音樂、醫藥三方面人才之培養，並組織董事會經理其事，定名為育群獎學基金會。,由發起人張繼正、張繼忠、張亞蘭等共同捐助,教育部中華民國62年10月5日台(62)高字第25374號函,永久,3000000,1,0760703,0760703,,,,,陳正賢,清算人執行職務之情形：本會自有資產共計新台幣3,763,804元，除保留應付預估解散清算時所需開支之零用現金新台幣4,804元外，其餘全部剩餘財產為3,759,000元依照本會75年度第1次臨時董事會決議及報奉核定之剩餘財產捐贈對象平均分配與「台北市教會聚會所」、「台北市基督教浸信會懷恩堂」及「美國洛杉磯市培城國語浸信會」等三機構，各得三分之一為新台幣1,253,000元。剩餘財產之捐贈亦經於75年8月下旬分別開具交通銀行支票函送各受贈人，並經各受贈人先後出具收據寄回一併附存剩餘財產捐贈清冊，同時本會在通銀行設立之甲種支票存款戶予以結清並註銷外，本會帳面淨值（基金及公積）新台幣3,759,000元亦隨即消滅。至於保留之零用現金新台幣4,804元，截至75年10月14日已支付解散公告刊登費及郵費等新台幣1,874元，目前尚存新台幣2,930元，備繼續支付清算終結登記等開支。
077登000048,1,2,林貴美,639,0770303,0770303,0770303,32冊33頁,1,2,傅積寬,財團法人台灣省台北縣花園新城教會,0640621,台北縣新店市粗坑里花園新城橘園一路7號,以弘揚基督福音，利濟世人為目的,由信徒樂捐,臺北縣政府中華民國64年3月10日(64)北縣民字第48號設立許可證書,永久,663100,1,0770303,0770314,0770314,,,,,財產總額：新台幣66萬3,100元整。,,,,
077登000150,1,1,林貴美,1294,0770707,0770707,0770707,54冊31頁,,,汪敬煦,財團法人中華航空事業發展基金會,0770707,台北市南京東路3段131號,本會以協助中華民國航空事業發展、研究及有關活動之推展為宗旨。,捐助中華航空股份有限公司股票計普通股23,999,880股連同其孳息,交通部中華民國77年7月6日交航(77)字第018113號函,無限期,5532645517,1,0770707,0770709,0770708,,,,,,,,,
077登000265,1,2,林貴美,1178,0771124,0771124,0771124,50冊35頁,1,1,吳尹生,財團法人台北市古亭基督長老教會,0750919,台北市大安區羅斯福路3段149號12樓,傳揚基督福音，引人歸主，並舉辦慈善育英公益事業。,由財團法人北部台灣基督長老教會七星中會及本會教友捐贈,台北市政府民政局七十五年九月四日北市民三字第三五一四九號函,永久,15507000,1,0771124,0771205,0771129,,,,,財產總額：土地兩筆、建物五筆，價值新台幣1,550萬7,000元整。,,,,
078登000023,1,2,林貴美,717,0780126,0780128,0780128,35冊9頁,2,5,趙諒公,財團法人中華民國紡織業外銷拓展會,0660609,台北市中正區愛國東路22號,本會以配合國策謀求全體紡織業之發展，加強產銷技能，促進輸出為目的。,捐助,經濟部中華民國65年1月9日經(65)貿字第00824號函,永久,447936858,1,0780128,0780202,0780130,,,,,董事、第2屆監察人財產總額：新台幣4億4,793萬6,858元。,,,,
078登000036,1,2,林貴美,69,0780220,0780222,0780222,5冊23頁,1,8,簡崾聰,財團法人台灣聖公會,0480123,台北市杭州南路1段105巷7號,本會目的係本耶穌基督之精神，在中華民國台灣地區各處設立教堂，傳揚基督福音及教義，辦理社會公益慈善教育事業。並遵基督教聖公宗之規定，訓練、任命牧職聖品及傳道人員，以牧養信徒；管理教堂、監理有關事業。,美國聖公會暨他人之捐助。,臺灣省政府中華民國47年11月26日府民一字第10970號函通知,永久,371094314,1,0780222,0780222,,,,,,財產總額變更為新台幣3億7,109萬4,314元正。,,,,
078登000057,1,2,林貴美,495,0780313,0780314,0780314,27冊45頁,1,6,陳芳鑄,財團法人義芳慈善基金會,0620210,台北市康定路281號,以濟助台北市社會救助戶暨資助其子女完成學業及升學並辦理慈善公益事業為宗旨。,由大洋塑膠、義芳塑膠、義芳化學工業股份有限公司全額認捐。,臺北市政府社會局中華民國62年2月8日北市社三字第1553號函,永久,73248552,1,0780314,0780322,0780322,,,,,財產總額：新台幣7,324萬8,552元正。,,,,
078登000070,1,2,林貴美,1272,0780320,0780321,0780321,53冊47頁,1,1,李鍾桂,財團法人中國青年服務事業文教基金會,0770413,台北市中山區松江路219號,以服務青年，推展各項文教活動為宗旨。,捐助,"教育部七十七年三月廿三日  台︵七七︶高字第一一八九三號",永久,27303790,1,0780321,0780328,0780324,,,,,董事楊冬續因退休辭任，補選司徒明繼任財產總額：基金總額新台幣2,730萬3,790元。（含新台幣現金2,000,000元，股票新台幣25,303,790元）,,,,
078登000081,1,2,林貴美,1307,0780406,0780406,0780406,54冊57頁,1,,賴崇慶,財團法人科園高爾夫基金會,0770805,台北市光復南路102號11樓,以推展全民體育、提倡高爾夫球運動、增進國民健康、促進社會繁榮為目的。,本基金會由吳東進、賴崇慶、王鎮鳳捐助,"教育部七十七年七月三十日  台︵七七︶體字第三五三四五號函",永久,16000000,1,0780406,0780413,0780410,,,,,財產總額：新台幣1,600萬元整。,,,,
078登000236,1,2,林貴美,806,0780905,0780906,0780906,38冊7頁,2,4,劉今程,財團法人中華民國貿易教育基金會,0680402,台北市中山區松江路350號,以興辦貿易教育，協助貿易從業人員進修及對國際貿易問題研究推廣為宗旨。,創辦人台北市進出口商業同業公會及黃政旺先生等四十二人捐助,教育部中華民國68年3月14日台(68)高字第6606號函,永久,10000000,1,0780906,0780915,0780911,,,,,董事（備註─財產總額：基金新台幣1,000萬元正，不動產總值新台幣3億5,000萬元正。）,,,,
078登000241,1,2,林貴美,1228,0780905,0780906,0780906,52冊15頁,1,1,李鍾桂,財團法人中國青少年輔導基金會,0761022,台北市松江路219號,本會以配合政府政策辦理青少年身心輔導與心理衛生教育推廣等有關工作，以加強青少年生活適應能力，激發其潛能，創造幸福美滿人生，進而促進社會國家之安和樂利為宗旨。,由中國青年反共救國團、金寶電子工業、台灣石化合成、統一企業等股份有限公司捐助。,"教育部七十六年十月九日  台高字四七八六四號函",永久,28586400,1,0780906,0780922,0780911,,,,,董事楊冬續因退休辭任，補選司徒明繼任財產總額：新台幣415萬元整與幼獅文化事業股份有限公司股權2,443,640股，票面金額計新台幣24,436,400元。,,,,
078登000260,1,2,施芳玲,614,0781012,0781012,0781012,31冊43頁,2,,各董事,財團法人醫學生物儀器發展基金會,0631123,台北市羅斯福路四段二十四巷二十五號,以研究發展醫學、生物科學有關之儀器及保養，培養醫學生物儀器有關技術人員。,由美國醫藥助華捐助，嗣後並繼續籌募,行政院衛生署六十三年十一月九日　()衛署醫字第五二九四八號函,永久,3451838,1,0781012,0781020,0781020,,,,,董事財產總額：新台幣345萬1,838元整。,,,,
078登000308,1,2,林貴美,905,0781130,0781204,0781204,41冊25頁,1,3,各董事,財團法人慈暉社會福利基金會,0700609,台北市羅斯福路3段245號8樓之1,救助貧苦婦孺病疾療治。獎助孤兒教育。救助貧苦家變急難。其他有關社會福利服務。獎助優良傳統文化之發揚。,由林金海先生等共同捐助,內政部七０年五月十二日　台內社字第二０九０二號函,永久,30800000,1,0781204,0781214,0781208,,,,,財產總額：新台幣3,080萬元整。,,,,
078登000328,1,1,林貴美,1431,0781221,0781229,0781229,59冊9頁,,,李　模,財團法人趙廷箴文教基金會,0781229,台北市忠孝東路4段312號4樓之3,本會以發揚中華文化提高文教水準為宗旨。,創立時由華夏海灣塑膠股份有限公司捐助1,700萬元、台達化學工業股份有限公司捐助1,700萬元、亞洲聚合股份有限公司捐助1,700萬元及華夏投資股份有限公司捐助3,400萬元作為基金。,教育部中華民國78年12月20日台(78)社字第62977號函,無限期,85000000,1,0781229,0781230,0781229,,,,,,,,,
079法登000176,1,1,張茂寅,46,0451106,0451106,0451107,4冊7頁,,0,董事長,財團法人台北市法華寺,0451106,台北市西寧南路一九四號,為宣揚佛教教義、擴充佛教基礎,廣佈善道、舉辦慈善救濟事業,社會福利為目的。,由各捐助人共同集款。,台北市政府四十五年九月廿九日　︵四五︶北市民社字第００二七０二號函,永久,948475,1,0451106,0451106,,,,,,,,,,
079法登000289,1,1,林貴美,589,0630706,0630706,0630707,30冊53頁,,0,鄭惠芝,財團法人台北市私立立人國民小學,0630706,台北市大安區安和路一七五號,為遵照國家教育政策暨現行教育法令之規定,辦理私立立人國民小學暨附設幼稚園，並謀其健全發展。,由前任董事長孫霆先生、常務董事鄭惠芝、孫陛麟、于斌捐助。,台北市政府五十四年八月十二日　府教國字第三六０一九號函,永久,1096693112,1,0630706,0630706,0841227,,,,,,,,,
079登000055,1,2,林貴美,835,0790226,0790301,0790301,39冊5頁,1,,各董事,財團法人味全文化教育基金會,0681221,台北市松江路125號,培育各種專門人才、推行社會教育、研習各種技藝、增進國內外人民之溝通與瞭解、促進家庭生活之美滿與和諧，進而促成安和樂利之社會。,由各董事募集捐助或接受有關機構，社團及個人之捐助,教育部中華民國68年12月15日台(68)社字第39135號函,永久,65642550,1,0790301,0790309,0790303,,,,,財產總額：新台幣6,564萬2,550元整。,,,,
079登000111,1,2,林貴美,1187,0790410,0790411,0790411,50冊53頁,1,,林華鄂,財團法人樂山文教基金會,0751219,台北市敦化南路359號1樓,發揚傳統藝術文化，提升國人文化生活層次，促進國際間藝術文化之交流，增進社會福利與和諧。,捐助。,"七十五年十二月十一日教育部  台︵七五︶高字第五六七四二號函",永久,33000000,1,0790411,0790420,0790417,,,,,財產總額：新台幣3,300萬元正。,,,,
079登000194,1,2,林貴美,455,0790709,0790710,0790710,26冊25頁,1,3,各董事,財團法人台北市慧炬雜誌社,0610327,台北市大安區建國南路1段270巷10號,本法人設立宗旨為宣揚中國佛教文化，導正社會人心，發行慧炬雜誌，為公益慈善團體，不以牟利為目的。,董事募捐,臺北市政府中華民國61年2月26日61.2.26府新一字第6620號通知,永久,10000000,1,0790710,0790717,0790717,,,,,財產總額變更為新台幣1,000萬元。,,,,
079登000284,1,2,林貴美,1228,0790926,0791004,0791004,52冊15頁,2,2,李鍾桂,財團法人中國青少年輔導基金會,0761022,台北市中山區松江路219號,本會以配合政府政策辦理青少年身心輔導與心理衛生教育推廣等有關工作，以加強青少年生活適應能力，激發其潛能，創造幸福美滿人生，進而促進社會國家之安和樂利為宗旨。,由中國青年反共救國團、金寶電子工業、台灣石化合成、統一企業等股份有限公司捐助。,"教育部七十六年十月九日  台高字四七八六四號函",永久,29773608,1,0791004,0791012,0791008,,,,,董事財產總額：新台幣533萬7,208元整與幼獅文化事業股份有限公司股權2,443,640股，票面金額計新台幣24,436,400元。
080法登000287,1,1,張茂寅,1618,0801011,0801011,0801012,65冊29頁,,0,王瑞瑜,財團法人台北市私立扶生社會福利事業基金會,0801011,台北市敦化北路二０一之三０號後棟十二樓,以辦理醫療救濟為目的。,"ROCHEUX INTERNATION","INC.  諾實國際公司捐贈",台北市政府社會局八十年九月廿六日　北市社二字第三七八四二號函,永久,10000000,1,0801011,0801011,,,,,,,,,,
080登000005,1,2,林貴美,908,0791228,0800108,0800108,41冊31頁,2,4,蔣碩傑,財團法人中華經濟研究院,0700624,台北市大安區長興街75號,從事國內、國際及特定地區經濟之研究，並以其研究成果提供政府作決策上之參考。舉辦有關學術活動，促進國內外學術交流。接受各界之研究委託，並提供經濟資訊等有關服務。,由中央政府、中美經濟社會發展基金及工商界共同捐助,經濟部七十年六月十日　經︵七十︶技字第二二九五九號函,永久,1097953084.81,1,0800108,0800117,0800115,,,,,董事財產總額：基金共新台幣10億4,011萬3,750元整。設備及圖書等合計共新台幣5,783萬9,334.81元。,,,,
080登000017,1,2,林貴美,1356,0800115,0800117,0800117,56冊35頁,1,,黃永松,財團法人龍虎文化基金會,0780327,台北市八德路4段72巷16弄5之2號,以發揚中國傳統文化為宗旨。,由英文漢聲出版有限公司捐助。,"教育部七十八年三月八日 台社一０一六八字號函",永久,13320000,1,0800117,0800125,0800121,,,,,財產總額：新台幣1,332萬元正。,,,,
080登000095,1,2,林貴美,1361,0800326,0800402,0800402,56冊45頁,1,1,劉金標,財團法人捷安特體育基金會,0780427,台北市南京東路5段16號8樓之4,以倡導全民運動發展國民之健全體格為宗旨。,劉金標等九人捐助,"教育部七十八年三月十五日  台︵七八︶體字第一一三０三號函",永久,35000000,1,0800402,0800415,0800408,,,,,財產總額：新台幣3,500萬元整。,,,,
080登000112,1,2,林貴美,1367,0800411,0800416,0800416,56冊57頁,1,,蘇錫清,財團法人台北市清靜社會福利事業基金會,0780504,台北市大安區復興南路2段327號15樓之1,以辦理貧病濟助暨協助家境清寒但資賦優異學子完成教育為目的。,蘇錫清及王淑靜夫婦無償捐助,台北市政府社會局七十八年二月二十五日　北市社二字第五六七五號函,永久,15000000,1,0800416,0800425,0800422,,,,,財產總額：新台幣1,500萬元整。,,,,
080登000266,1,2,王聖惠,1451,0800906,0800913,0800913,59冊49頁,1,1,游淮銀,財團法人新道文教基金會,0790215,台北市光復南路240巷9號12樓,協助倡導倫理道德，促進社會和諧進步為宗旨，從事或贊助編著出版、發行，並支援舉辦有益社會大眾身心健康之文化活動。,富隆證券股份有限公司等捐助,"教育部七十九年一月廿五日  台︵七九︶社字第三九六六號函",永久,82000000,1,0800913,0800920,0800917,,,,,董事葉守本辭任，補選李成家繼任財產總額：新台幣7,000萬元及會所一幢共計8,200萬元正。,,,,
080登000285,1,2,王聖惠,1588,0800925,0801003,0801003,64冊25頁,1,1,陳立夫,財團法人孫瑞麟先生文教基金會,0801003,台北市南海路45號中華民國孔孟學會內,以宏揚中華文化－孔孟學術思想為宗旨。,由已故孫瑞麟先生遺贈,"教育部八十年四月九日  台︵八０︶社字第一五八五九號函",永久,13289717,1,0801003,0810115,0801008,,,,,"董事黃柱權辭任，補選李昌槿繼任董事孫啟誠、高群鶴住所變更如下：董　事　　　孫啟誠　　　No.6-8 Bowery","6th Flr. New York N.Y. 10013 U.S.A.。董　事　　　高群鶴　　　香港九龍美孚新村百老坸街18號18樓Ｂ座。",,,,
080登000287,1,1,王聖惠,1618,0801003,0801011,0801011,65冊29頁,,,王瑞瑜,財團法人台北市私立扶生社會福利事業基金會,0801011,台北市敦化北路201之30號後棟12樓,濟助生活困難老弱疾病者等慈善事業,"ROCHEUX INTERNATION","INC.  諾實國際公司捐贈",臺北市政府社會局中華民國80年9月26日北市社二字第37842號函,永久,10000000,1,0801011,0801018,0801016,,,,,,,,,
080登000323,1,2,王聖惠,1291,0801108,0801113,0801113,54冊25頁,2,2,曹　慶,財團法人台北市私立創世社會福利事業基金會,0770620,台北市中正區北平東路28號4樓,辦理社會救助及兒童、老人、婦女、殘障福利慈善事業為目的。,由曹慶等人繼續捐助。,台北市政府社會局七十七年六月三日　北市社三字第一八九三五號函,永久,39370000,1,0801113,0810226,0801120,,,,,董事財產總額：新台幣100萬元、不動產房屋價值新台幣3,837萬元。,,,,
080登000341,1,2,王聖惠,518,0801123,0801204,0801204,28冊31頁,2,8,周肇源,財團法人台北市私立靜心國民小學,0620611,台北市文山區興隆路2段46號,以創辦私立靜心國民小學並謀發展為目的。,由創辦人蔣緯國先生捐助,臺灣省臺北市政府中華民國46年7月4日北市教國字第24600號令,永久,11598191,1,0801204,0810513,0801213,,,,,董事財產總額：新台幣1,159萬8,191元。,,,,
